### ISSUE TITLE
how can I block the broadcasts/multicasts from the tuya smartplug device?

### ISSUE THREAD

**Issue by aleqx** [codetheweb/tuyapi#149]
Not really this project's fault, but the broadscasts/multicasts from my Tuya-compatible wifi smartplug are (for some bizzare reason!) being rebroadcasted further to the internet on tcp connections I make to internet hosts, and some of those hosts reply back again rebroadcasting it, messing with the app that is supposed to receive different json-rpc messages ...

I tried to drop all IP traffic from the wifi smartplug device but they are still coming through
```
iptables -A INPUT -s 192.168.10.50 -j DROP
```
The tcpdump still shows the json-rpc packets coming from that IP, and then the host rebroadcasting them to all hosts it is connected to. 

First time I'm seeing anything like it. Can a kind soul help, please?

**Comment by aleqx** [comment]
The added problem is that other machines on my LAN are also rebroadcasting these packet, so blocking the smartplug's IP doesn't make a difference.

**Comment by codetheweb** [comment]
If your router / local machine is actually translating UDP packets to TCP packets and then sending them to random sockets that would be a very strange bug indeed....

I'm not a network expert, but AFAIK you're describing the intended behavior in your second comment.  If a packet is sent to the network's broadcast address, the router (again, AFAIK) broadcasts the packet on all interfaces possible to all devices possible.

Any more details you can provide related to your first comment?

**Comment by unparagoned** [comment]
Are you sure you have no tuya apps running on your phone. Or have multiple instances of tuyapi running.

**Comment by aleqx** [comment]
Nothing is running on the phone (and the physical wifi network with the smartplugs is in another country than I am).

> If a packet is sent to the network's broadcast address, the router (again, AFAIK) broadcasts the packet on all interfaces possible to all devices possible.

I wasn't talking about the router, but about other machines on the LAN. They are rebroadcasting too.

It turns out I was blocking the broadcast from 192.168.10.50, but using tcpdump is misleading, because tcpdump sits in front of iptables (i.e. tcpdump will always see everything coming in). 

I still have no idea why would a local LAN machine send the json-rpc message on to internet hosts ... that's what I'm seeing in tcpdump, unless that's a tcpdump bug of some sort:

Smartplug ip = `192.168.10.50`
Linux LAN machine = `192.168.10.213`
Another LAN machine = `192.168.10.101`
Internet host = `165.227.<snip>.<snip>`

```
6910  23:09:20.881130 IP 192.168.10.213.45912 > 165.227.<snip>.<snip>.50483:    {"ip":"192.168.10.50","gwId":"002007782c3ae812a933","active":2,"ability":0,"mode":0,"encrypt":true,"productKey":"turAAs6wYyKbH2BH","version":"3.1"}
```

Why and how does a LAN machine send the Tuya json-rpc message on to an internet host?

Here it is sending it among themselves (I don't mind that):

```
6051  22:45:26.978403 IP 192.168.10.101.1006 > 192.168.10.213.514:    {"ip":"192.168.10.50","gwId":"002007782c3ae812a933","active":2,"ability":0,"mode":0,"encrypt":true,"productKey":"turAAs6wYyKbH2BH","version":"3.1"}
...
...
6927  23:09:42.933164 IP 192.168.10.213.514 > 192.168.10.101.1007:    {"ip":"192.168.10.50","gwId":"002007782c3ae812a933","active":2,"ability":0,"mode":0,"encrypt":true,"productKey":"turAAs6wYyKbH2BH","version":"3.1"}
```

**Comment by codetheweb** [comment]
Sorry, but that's beyond my skillset to help with...

A few things that may be helpful in debugging this:
- Tuya devices ping Tuya's servers every so often with information similar to what you're seeing.
- The local UDP packets that Tuya devices broadcast are wrapped in Tuya's protocol.  Unless tcpdump isn't showing non-printable characters (very possible) it appears Machine A may be decoding packets from the device, which shouldn't be possible without TuyAPI installed.

**Comment by aleqx** [comment]
What I posted above is tcpdump running on machine A (`tcpdump -U -A -n -l not icmp and not arp and port not '(53 or 123 or 22 or 2049 or 1909'`), and you can see the tcpdump output, i.e. what tcpdump sees at interface level. You can clearly see the json-rpc messages from Tuya and that it is being sent to tan internet host. Machine A has nothing Tuya related installed on it, so it's definitely not encrypted in any fashion. *ALL* machines on this LAN are doing the same thing, believe it or not.

**Comment by unparagoned** [comment]
I ran ```tcpdump -U -A -n -l not icmp and not arp and port not '(53 or 123 or 22 or 2049 or 1909)'```
And everything was from the devices, there were no rebroadcasts that I saw. Are you sure your computers/routers aren't set up to rebroadcast anything sent to``` > 255.255.255.255.6666: UDP, length 175```
Try ```sudo echo -ne '\x41\x00\x55' > /dev/udp/192.168.10.255/6666``` and see if that gets rebroadcast?

**Comment by codetheweb** [comment]
Closing this because of inactivity.

@aleqx if you're still seeing issues and you think I can help/provide more information, feel free to reopen this.
